=== START OF INFORMATION SECTION ===
Model Family:     Seagate BarraCuda 3.5
Device Model:     ST2000DM008-2FR102
Serial Number:    ZFL3K9RT
LU WWN Device Id: 5 000c50 0d4a8f6c2
Firmware Version: 0001
User Capacity:    2,000,398,934,016 bytes [2.00 TB]
Sector Sizes:     512 bytes logical, 4096 bytes physical
Rotation Rate:    7200 rpm
Form Factor:      3.5 inches
Device is:        In smartctl database [for details use: -P show]
ATA Version is:   ACS-3 T13/2161-D revision 5
SATA Version is:  SATA 3.2, 6.0 Gb/s (current: 6.0 Gb/s)
Local Time is:    Thu Dec 14 09:23:47 2023 UTC
SMART support is: Available - device has SMART capability.
SMART support is: Enabled
AAM feature is:   Unavailable
APM level is:     128 (minimum power consumption without standby)
Rd look-ahead is: Enabled
Write cache is:   Enabled
DSN feature is:   Unavailable
ATA Security is:  Disabled, frozen [SEC2]

=== START OF READ SMART DATA SECTION ===
SMART overall-health self-assessment test result: FAILED!
Drive failure expected in less than 24 hours. SAVE ALL DATA.

General SMART Values:
Offline data collection status:  (0x82) Offline data collection activity
                                        was completed without error.
                                        Auto Offline Data Collection: Enabled.
Self-test execution status:      ( 121) The previous self-test completed having
                                        the read element of the test failed.
Total time to complete Offline 
data collection:                (  575) seconds.
Offline data collection
capabilities:                    (0x7b) SMART execute Offline immediate.
                                        Auto Offline data collection on/off support.
                                        Suspend Offline collection upon new
                                        command.
                                        Offline surface scan supported.
                                        Self-test supported.
                                        Conveyance Self-test supported.
                                        Selective Self-test supported.
SMART capabilities:            (0x0003) Saves SMART data before entering
                                        power-saving mode.
                                        Supports SMART auto save timer.
Error logging capability:        (0x01) Error logging supported.
                                        General Purpose Logging supported.
Short self-test routine 
recommended polling time:        (   1) minutes.
Extended self-test routine
recommended polling time:        ( 223) minutes.
Conveyance self-test routine
recommended polling time:        (   2) minutes.
SCT capabilities:              (0x30a5) SCT Status supported.
                                        SCT Data Table supported.

SMART Attributes Data Structure revision number: 10
Vendor Specific SMART Attributes with Thresholds:
ID# ATTRIBUTE_NAME          FLAG     VALUE WORST THRESH TYPE      UPDATED  WHEN_FAILED RAW_VALUE
  1 Raw_Read_Error_Rate     0x000f   078   064   006    Pre-fail  Always   -       154728964
  3 Spin_Up_Time            0x0003   097   097   000    Pre-fail  Always   -       0
  4 Start_Stop_Count        0x0032   100   100   020    Old_age   Always   -       487
  5 Reallocated_Sector_Ct   0x0033   001   001   010    Pre-fail  Always   FAILING_NOW 3847
  7 Seek_Error_Rate         0x000f   086   060   045    Pre-fail  Always   -       453892741
  9 Power_On_Hours          0x0032   068   068   000    Old_age   Always   -       28543
 10 Spin_Retry_Count        0x0013   100   100   097    Pre-fail  Always   -       0
 12 Power_Cycle_Count       0x0032   100   100   020    Old_age   Always   -       485
183 Runtime_Bad_Block       0x0032   092   092   000    Old_age   Always   -       8
184 End-to-End_Error        0x0032   100   100   099    Old_age   Always   -       0
187 Reported_Uncorrect      0x0032   001   001   000    Old_age   Always   -       8942
188 Command_Timeout         0x0032   100   099   000    Old_age   Always   -       1 1 2
189 High_Fly_Writes         0x003a   100   100   000    Old_age   Always   -       0
190 Airflow_Temperature_Cel 0x0022   063   048   040    Old_age   Always   -       37 (Min/Max 21/52)
191 G-Sense_Error_Rate      0x0032   100   100   000    Old_age   Always   -       0
192 Power-Off_Retract_Count 0x0032   100   100   000    Old_age   Always   -       124
193 Load_Cycle_Count        0x0032   098   098   000    Old_age   Always   -       4523
194 Temperature_Celsius     0x0022   037   052   000    Old_age   Always   -       37 (0 21 0 0 0)
197 Current_Pending_Sector  0x0012   001   001   000    Old_age   Always   -       5624
198 Offline_Uncorrectable   0x0010   001   001   000    Old_age   Offline  -       5624
199 UDMA_CRC_Error_Count    0x003e   200   200   000    Old_age   Always   -       0
240 Head_Flying_Hours       0x0000   100   253   000    Old_age   Offline  -       28387h+12m+45.832s
241 Total_LBAs_Written      0x0000   100   253   000    Old_age   Offline  -       45782394852
242 Total_LBAs_Read         0x0000   100   253   000    Old_age   Offline  -       89347582947

SMART Error Log Version: 1
ATA Error Count: 8942 (device log contains only the most recent five errors)
        CR = Command Register [HEX]
        FR = Features Register [HEX]
        SC = Sector Count Register [HEX]
        SN = Sector Number Register [HEX]
        CL = Cylinder Low Register [HEX]
        CH = Cylinder High Register [HEX]
        DH = Device/Head Register [HEX]
        DC = Device Command Register [HEX]
        ER = Error register [HEX]
        ST = Status register [HEX]
Timestamp = decimal seconds since the previous disk power-on.

Error 8942 occurred at disk power-on lifetime: 28543 hours (1189 days + 7 hours)
  When the command that caused the error occurred, the device was active or idle.

SMART Self-test log structure revision number 1
Num  Test_Description    Status                  Remaining  LifeTime(hours)  LBA_of_first_error
# 1  Extended offline    Completed: read failure       90%     28542         3284759472
# 2  Short offline       Completed: read failure       90%     28541         3284759472
# 3  Extended offline    Completed: read failure       90%     28532         3284759472
# 4  Short offline       Completed without error       00%     28498         -

SMART Selective self-test log data structure revision number 1
 SPAN  MIN_LBA  MAX_LBA  CURRENT_TEST_STATUS
    1        0        0  Not_testing
    2        0        0  Not_testing
    3        0        0  Not_testing
    4        0        0  Not_testing
    5        0        0  Not_testing
Selective self-test flags (0x0):
  After scanning selected spans, do NOT read-scan remainder of disk.
If Selective self-test is pending on power-up, resume after 0 minute delay.